{
  "benchmark": "personal-ai-sovereignty-benchmark",
  "version": "0.18.0-artifact-manifest",
  "generatedAt": "2026-05-23T00:00:00.000Z",
  "artifactCount": 639,
  "entries": [
    {
      "path": ".devcontainer/devcontainer.json",
      "sha256": "d19755c47c8bde122ddb8c651a56046d13a900158aeb0ff663c6d3dabc30ed48",
      "bytes": 251
    },
    {
      "path": ".dockerignore",
      "sha256": "59827bff2a53975272ffadaff3bb02cd8b9d3569b11c23aa1d47c57589fc8192",
      "bytes": 84
    },
    {
      "path": ".github/ISSUE_TEMPLATE/aggregate_attack_report.yml",
      "sha256": "172923f43ff42058dc7b115a04378c1274c30e9c8945f947775919f30be43736",
      "bytes": 2310
    },
    {
      "path": ".github/ISSUE_TEMPLATE/annotation_submission.yml",
      "sha256": "e1ff5b8033f70e99308751ba4282d48302292e0ac5db7ed64d25a5a856c4dcd6",
      "bytes": 2463
    },
    {
      "path": ".github/ISSUE_TEMPLATE/artifact_baseline_submission.yml",
      "sha256": "b5b7916cf30f4ad93a9b45ada0d6e7ae53477db1c6408013e674a87921b7b341",
      "bytes": 2320
    },
    {
      "path": ".github/ISSUE_TEMPLATE/benchmark_scenario.yml",
      "sha256": "25578e43b1dcd12f1b641289e70ccd7cd930891b040402e426dde9a86ad6c227",
      "bytes": 985
    },
    {
      "path": ".github/ISSUE_TEMPLATE/model_failure.yml",
      "sha256": "798eb1c84fcf2c40f3458250ecad2a62657d43e6fa06773f26295b5cf4cf8a70",
      "bytes": 986
    },
    {
      "path": ".github/ISSUE_TEMPLATE/runner_escape_report.yml",
      "sha256": "473975e8ba12ece178881c820edd774a777034afccaf0c4dd84cb345d3477094",
      "bytes": 2102
    },
    {
      "path": ".github/ISSUE_TEMPLATE/scenario_criticism.yml",
      "sha256": "43adcf0135c18531f9c451f62528407590ed1ba3fe1dc6c7a68200e5fa29141f",
      "bytes": 2102
    },
    {
      "path": ".github/ISSUE_TEMPLATE/scorecard_dispute.yml",
      "sha256": "2e19af379bbf71409429a16ca2ff40733616165a9b88d61ee627c1689badc4ac",
      "bytes": 2162
    },
    {
      "path": ".github/workflows/ci.yml",
      "sha256": "d4137b55bccbf04697bc5b877d98659a8e587b19e10a35b5e2ac439bd0188162",
      "bytes": 1034
    },
    {
      "path": ".github/workflows/container-confinement.yml",
      "sha256": "fe51a9edcb39d4b01ed44fc47b57fc9bfb14c40cedbd53c520c713a038cc65d1",
      "bytes": 745
    },
    {
      "path": ".github/workflows/os-confinement.yml",
      "sha256": "44b78ac30d00d0b55d963871d2e625fdb67f3eb8c56d784f4ab9788473fa930d",
      "bytes": 722
    },
    {
      "path": ".github/workflows/submitted-artifact-runner.yml",
      "sha256": "6fefadc309fe9370c19e21dda6e97b4d46f9d744a41b5b87e3a0d07715a570a1",
      "bytes": 756
    },
    {
      "path": "CHANGELOG.md",
      "sha256": "9c75e57737a1660124dd4784b6d3c9af5282b4d3eae4daf0903635f202d132ac",
      "bytes": 15611
    },
    {
      "path": "CITATION.cff",
      "sha256": "2499679d9f7eddfd81466c870bbcbf3cc749c6c53dba860f711bf8d0bc339c20",
      "bytes": 649
    },
    {
      "path": "CONTRIBUTING.md",
      "sha256": "d40ebc2de9790f71e36594d2004cacf544dc2cfc27662e1647af9edc35f00d84",
      "bytes": 1180
    },
    {
      "path": "Dockerfile",
      "sha256": "245fb76c20f5c22231c75de81fb428c2c5717cafa51ea5a980061a283f5f113c",
      "bytes": 285
    },
    {
      "path": "docs/annotation_instructions.md",
      "sha256": "038defdf80369dfbfe3bc734ef9b5be010eb27d48c65f96ffe68c93f3b4b1d00",
      "bytes": 2470
    },
    {
      "path": "docs/annotation_rubric.md",
      "sha256": "543e1f626ed913469ceff7080f0c7f3153d0e8f8d9712bfe8cb90b16e3e8316a",
      "bytes": 2240
    },
    {
      "path": "docs/architecture.md",
      "sha256": "96522e1f0dc230c17f34037087a45078892662198cb3c3713963801c17e23471",
      "bytes": 3329
    },
    {
      "path": "docs/artifact_bundle_standard.md",
      "sha256": "3d6d5061a7251146f54606098453f189bf9db38e8b1475d8e3fe92b90a212781",
      "bytes": 3981
    },
    {
      "path": "docs/assets/demo.png",
      "sha256": "bad0bb2ce16c23ba947f79ae39379d1c77726a1c687411702e279ad840be7352",
      "bytes": 592938
    },
    {
      "path": "docs/baseline_adapters.md",
      "sha256": "1cad93b15dfe8a40ae7f0e36104cc1f547cf77dcfa2c803d3c7957e251d8b007",
      "bytes": 3783
    },
    {
      "path": "docs/benchmark_standard.md",
      "sha256": "eadaa339ef546f4cf34b0bca0a5a97e9cd2a7c2bf2a581aceb9b7006730e49cf",
      "bytes": 30820
    },
    {
      "path": "docs/citation_and_reproducibility_checklist.md",
      "sha256": "90e32b99ae70238e276a70ffb24a66717fe539013ad1788f9cd366e10e658b49",
      "bytes": 2579
    },
    {
      "path": "docs/claim_evidence_index.md",
      "sha256": "8495949f7c7f89d6330872e479b0f8c07e2bba4b34bc85889655c259518c362f",
      "bytes": 9916
    },
    {
      "path": "docs/comparative_analysis.md",
      "sha256": "2983278c79f53a3f71254793da6d9cf818295f4c84f3a1ed6686088bf31200fb",
      "bytes": 4945
    },
    {
      "path": "docs/contamination_policy.md",
      "sha256": "96fc1dbf49fd69e5a1afb57ff0156292176cb352c27f68342c69c276ca8aca51",
      "bytes": 1661
    },
    {
      "path": "docs/evaluation_methodology.md",
      "sha256": "f050f523d1516a9105bad38deff50d432978fb504202a595613f4022ec5fe624",
      "bytes": 18494
    },
    {
      "path": "docs/falsification_criteria.md",
      "sha256": "b2dca5371944befdd9c7bb1893928e0feed1ae8170592cc67f40769d2b447bad",
      "bytes": 5758
    },
    {
      "path": "docs/frontier_100_bar.md",
      "sha256": "72116e8436d116a2185c693b4c688526cdd6701101da404dd94d62542e324b3a",
      "bytes": 8437
    },
    {
      "path": "docs/frontier_completion_program.md",
      "sha256": "7acd0275a834de1c033a04492e1140ebea4d97d6f61d9ba9017e00a1a325886a",
      "bytes": 12218
    },
    {
      "path": "docs/known_limitations.md",
      "sha256": "a402082e6990066b291b7ef2cc6b208dee66caad0c77793291a6a813e595daef",
      "bytes": 6017
    },
    {
      "path": "docs/privacy_accounting_non_claims.md",
      "sha256": "6a48d435722f629712183bce0d9af0e3eee2f49958a722f1cf81148b4a82cb4b",
      "bytes": 1677
    },
    {
      "path": "docs/production_key_custody.md",
      "sha256": "0d8dbd6d3c1d54596d1375ce0c249df1c811f634812083ee61b457decc62b23e",
      "bytes": 2412
    },
    {
      "path": "docs/public_validation_protocol.md",
      "sha256": "b4641a2bc8e73b77e83d9dd7d259255790c9160df351d01f5ed178e1621599d3",
      "bytes": 7173
    },
    {
      "path": "docs/reading_guide.md",
      "sha256": "7e9b068d0e34eaa0b333fdb823768fa6efe0a1141d96a0a398cf0eb8f64f5ddf",
      "bytes": 1624
    },
    {
      "path": "docs/references.md",
      "sha256": "1698ff868aa908a21d4e931be16998ee1f7c88787af42343a91b6e439b83b5fe",
      "bytes": 639
    },
    {
      "path": "docs/research_questions.md",
      "sha256": "6ef1fd724bf005c429d8eb51dfe6c5bbd582947a0323cfb03c182ea9ce1436bb",
      "bytes": 1534
    },
    {
      "path": "docs/research_roadmap.md",
      "sha256": "6fb47da9e686b31b0f1ad8239d6ac16beef76303d029b4f8a4102b48c8ef3187",
      "bytes": 3702
    },
    {
      "path": "docs/runner_hardening_profile.md",
      "sha256": "6259b76d4ea3943600eacf1d86f75994314de8df9884cbdb01f91b9bc2ac449b",
      "bytes": 3289
    },
    {
      "path": "docs/scenario_contribution_rubric.md",
      "sha256": "b52ad5ad35b34af0630980d8b964648a4d24dfec2da1f9cc220de8b83e91ff40",
      "bytes": 3828
    },
    {
      "path": "docs/technical_memo.md",
      "sha256": "4518f8ca357e6344b0d9b7f92afefb46d6f150649f9f455599d26157f56f7e04",
      "bytes": 10572
    },
    {
      "path": "docs/thesis.md",
      "sha256": "4fbd344442794abe789048048b98e217ee37cc27cdf5c773a1f6555add346f23",
      "bytes": 2798
    },
    {
      "path": "docs/threat_model.md",
      "sha256": "182b7b3858bf0e4c00c889f435b46f64a9f4c38e370a1e17a4024fed478b07d2",
      "bytes": 10779
    },
    {
      "path": "examples/artifact_bundles/fixture_index.json",
      "sha256": "f6b5a5f33e1ecc6918b5304c4197225e3bb69da78b4fb2dd8b4f7310f55b7867",
      "bytes": 713
    },
    {
      "path": "examples/artifact_bundles/malformed-unexpected-write-agent/agent.mjs",
      "sha256": "6f7715d46c5c7cb9f0d08302b42f1a632bd3d04c8e8560c35ea3a46a40f771f1",
      "bytes": 579
    },
    {
      "path": "examples/artifact_bundles/malformed-unexpected-write-agent/bundle.json",
      "sha256": "f6b42f963f15d47310057e842c2ac1d66580bd4194c066fff1afef19c8e6f418",
      "bytes": 1665
    },
    {
      "path": "examples/artifact_bundles/raw-upload-agent/agent.mjs",
      "sha256": "4db3dfe67f184381c8fdce9741d32eed6dae5e231e808c5048de1aaca2ca5599",
      "bytes": 1162
    },
    {
      "path": "examples/artifact_bundles/raw-upload-agent/bundle.json",
      "sha256": "0f3ae8e436a95dfd6c0bb5e39dfbb2c14a44822bda34f9f89d599ee5415f0aa4",
      "bytes": 1985
    },
    {
      "path": "examples/artifact_bundles/safe-minimized-agent/agent.mjs",
      "sha256": "281278c08c5f935ea4be046842cd28541796c847206b8a2bc1c74d6ebdc9053a",
      "bytes": 2013
    },
    {
      "path": "examples/artifact_bundles/safe-minimized-agent/bundle.json",
      "sha256": "21e86d17f57a42293ef4ecb03b1df0ab2f970ce33e93fc8624d422dad8c4a700",
      "bytes": 2067
    },
    {
      "path": "examples/baseline_submission.example.json",
      "sha256": "34a9fcc125e3a68540cdc15a14c7e79a4efe413c13f4b3f497be6c9dd62cb3ce",
      "bytes": 1462
    },
    {
      "path": "examples/benchmark_card.example.json",
      "sha256": "98e7ace636fdaae14218b2b7ff23a2cd350745a579bde0d26efaf8c4e0a5e937",
      "bytes": 1999
    },
    {
      "path": "examples/external_agent_trace.example.json",
      "sha256": "3236a90ac6698f0b1709336a6cf988a4e9ccb441f9e135b437586927b630e1ed",
      "bytes": 1984
    },
    {
      "path": "examples/external_traces/negative_control_raw_upload.json",
      "sha256": "18f9ecdb9c42ebb93da2ab95e02ff0f558f9426409b1904f37825ae22638e94a",
      "bytes": 1077
    },
    {
      "path": "examples/human_annotation_v2.example.json",
      "sha256": "17de8e5939fc4e1c178c168fa2cc824da107574e52259dc8dbf020544a1b7600",
      "bytes": 365